id,title,author,url,summary,quote,slug
65,How we'll know if Trump is going to sell America out to China,Noah Smith,https://www.noahpinion.blog/p/how-well-know-if-trump-is-going-to,"A detailed analysis of how Trump's potential handling of semiconductor export controls could signal America's stance against Chinese power. Noah Smith argues that while Trump's tariff threats grab headlines, the real test will be whether he maintains Biden's chip export restrictions. These controls have effectively slowed China's semiconductor advancement and preserved America's technological edge.","Just as only Nixon could go to China in the 1970s, we might find that only Trump could sell us out to China in the 2020s.",how-well-know-if-trump-is-going-to-sell-america-out-to-china
66,How two brothers built Buy Me a Coffee to empower over 1 million creators worldwide,Gracie Van,https://whatastartup.substack.com/p/how-two-brothers-built-buy-me-a-coffee-to-empower-over-1-million-creators-worldwide,"A simple idea to help content creators earn money transformed into a global platform supporting over a million creators worldwide. Two brothers from Kerala, India, turned their frustration with inconsistent blogging income into Buy Me a Coffee - a platform where fans can easily tip creators without commitments. Gracie Van details how Joseph and Jijo Sunny bootstrapped their way from a $1,600 domain purchase to a $4.9M annual revenue business, proving that solving real problems beats fancy connections.","Buy Me a Coffee proves that great ideas don't require big budgets or fancy connections—just a clear vision, simplicity, and focus on solving real problems.",how-two-brothers-built-buy-me-a-coffee-to-empower-over-1-million-creators-worldwide
67,"Netflix's withdrawal symptoms, and Africa's $10 billion gaming industry",Oritsejolomi Otomewo,https://www.readcommunique.com/p/netflix-nigeria-africa-gaming-industry,"A seismic shift is occurring in Africa's media landscape as Netflix scales back its Nigerian originals amid global content reduction. Oritsejolomi Otomewo explores how the streaming giant's pivot coincides with Africa's gaming industry preparing for explosive growth from $2.16 billion to $10.81 billion by 2033. The analysis reveals how mobile gaming dominates the continent's market, with 200 million gamers and innovative local studios creating culturally relevant content.","Mobile gaming dominates the African market, accounting for 60% of all gaming activity.",netflixs-withdrawal-symptoms-and-africas-10-billion-gaming-industry
68,How to Become a Paid Writer in 2025,Khadejah J,https://storycraft855.substack.com/p/how-to-become-a-paid-writer-in-2025,"A candid look at the path to profitable writing in the digital age. Khadejah J shares her journey from twice-quitting writer to earning $3k+ monthly through consistent publishing, strategic topic selection, and persuasive writing techniques. Her practical approach emphasizes daily writing habits, the 70/20/10 content rule, and emotional connection over perfect grammar to build a sustainable writing career.","Writing, especially online writing, is subjective.",how-to-become-a-paid-writer-in-2025
69,What Is Sora For?,Alex Kantrowitz,https://www.bigtechnology.com/p/what-is-sora-for,"OpenAI's latest video generator creates stunning clips of pandas on subways and winking statues, but struggles to find its purpose. Alex Kantrowitz explores how Sora, while technically impressive, exists in a peculiar space - too low-quality for professional production yet too complex for casual users. The technology points toward AI's growing understanding of physical reality, potentially laying groundwork for robotics and real-world interactions.","AI video will certainly improve, but Sora and its counterparts seem high on cool factor and low on utility, at least for now.",what-is-sora-for
70,What data rights are for (#2),Mahdi Assan,https://www.thecybersolicitor.com/p/what-data-rights-are-for-2,"A deep dive into how Facebook's key features shaped its surveillance capitalism model. Through detailed analysis of the News Feed, targeted advertising, and Like button implementations, Mahdi Assan reveals how these systems work together to maximize data collection while minimizing privacy protections. The author demonstrates how this creates a self-reinforcing cycle that prioritizes engagement and revenue over user wellbeing.",Do not give your data to entities that are not incentivised to use it in your best interests.,what-data-rights-are-for-2
71,Writers on Writers- Lisa Colón Delay,Robert the contemplative,https://musingsfromabrokenheart.substack.com/p/writers-on-writers-lisa-colon-delay,"A heartfelt exploration of writing, spirituality, and cultural heritage through the lens of an interview. Lisa Colón Delay shares her journey from childhood poetry to her current work on Desert Spirituality, revealing how her Puerto Rican roots and commitment to amplifying marginalized voices shape her creative process. Her writing focuses on overlooked historical figures and communities while drawing inspiration from resilient underdogs who maintain hope despite adversity.","What keeps me writing is also what keeps me creating: My curiosity, my desire to learn, grow, heal, and meaningfully connect with others, the Divine, and myself.",writers-on-writers-lisa-colon-delay
72,How to Monetize Your Mind,Ayodeji,https://dontstarve.substack.com/p/how-to-monetize-your-mind,"A comprehensive blueprint for turning skills and knowledge into a six-figure business within one year. Ayodeji breaks down the essential elements of successful entrepreneurship: the Profit Trifecta of enjoyable skills, audience attention, and viable marketplace. He emphasizes the importance of niching down, whether through coaching or done-for-you services, and introduces the intense Nightmare Protocol for rapid skill development.","Business isn't easy. But it's not complicated. The steps required are simple, but the execution is tough.",how-to-monetize-your-mind
73,Great Campaigns Start With Great Copy,Rachel Karten,https://www.milkkarten.net/p/great-campaigns-start-with-great,"A deep dive into the art of campaign validation through thoughtful copywriting. Rachel Karten reveals how starting with a clear thesis and compelling words can make or break marketing campaigns. Through expert insights from brands like Merit and creative leaders at FONZIE, she demonstrates how good copy acts as a lie detector test for campaign ideas, helping marketers avoid common pitfalls and create authentic connections.","Writing with 'gravitas' can cause your head to turn upward. Start with something true, let the truth resonate, then move in the direction of what you want to see in the world.",great-campaigns-start-with-great-copy
74,"The State of Design, In Four Parts",Bobby Aaron Solomon,https://thefoxisblack.substack.com/p/the-state-of-design-in-four-parts,"A scathing critique of recent developments in mainstream design unfolds through four major events. Bobby Solomon examines Pentagram's controversial use of AI for government icons, Jaguar's impractical concept car, Pantone's uninspired color of the year, and Spotify Wrapped's hollow design. His analysis reveals how corporate decisions and AI adoption are reshaping creative industries, often at the expense of human artistry.","AI is inevitable because it's cheap and easy, but there is a bifurcation occurring made up of those who appreciate people for their skills, and those who comprise the Idiocracy.",the-state-of-design-in-four-parts
75,Why Are Huge Tech Companies Getting Into the Book Business?,Ted Gioia,https://www.honest-broker.com/p/why-are-huge-tech-companies-getting,"A seismic shift is occurring in the publishing world as tech giants Microsoft and TikTok quietly launch book publishing ventures. Ted Gioia reveals how these moves, coupled with massive AI investments, signal a concerning pattern similar to what's happening in the music industry, where AI-generated content threatens to slash creator revenues. This shift marks phase three of the AI revolution: open warfare between tech companies and content creators, with transparency becoming a critical battleground.",The gaslighting is over—you can't fool musicians anymore. They now fully grasp the AI business model—which is to destroy their livelihood and replace human music with bot slop.,why-are-huge-tech-companies-getting-into-the-book-business
76,When Convenience Kills,Madison Huizinga,https://madisonhuizinga.substack.com/p/when-convenience-kills,"A thought-provoking exploration of how Trader Joe's embodies America's obsession with convenience through its ready-made meals and trendy food items. Madison Huizinga examines how the store's business model, while solving immediate needs, ultimately disconnects us from the sensory pleasures and essential human experiences of cooking, reflecting broader cultural shifts in our relationship with food preparation.","If we become so reliant on convenience, we'll lose the rewards found in doing hard things - from trying, failing, trying again, and perhaps again.",when-convenience-kills
77,What the humans like is responsiveness,Sasha Chapin,https://sashachapin.substack.com/p/what-the-humans-like-is-responsiveness,"A viral TikTok of a woman ordering food reveals a fundamental truth about human nature: we crave responsive interactions. Sasha Chapin explores how this quality - the ability to react genuinely and energetically to others - creates magnetic personalities and drives success stories like CD Baby's famous confirmation email. Beyond social charm, responsiveness emerges as a core human need, its absence potentially leading to burnout, gaming addiction, and social unrest.",Life is good if it squishes nicely when you poke it.,what-the-humans-like-is-responsiveness
78,The Case for Nonlinear Goal Setting,Anne-Laure Le Cunff,https://nesslabs.com/nonlinear-goal-setting,"A fresh look at how traditional goal-setting methods may be holding us back, using Spotify's evolution from music streaming upstart to global powerhouse as a compelling example. Drawing from neuroscience and psychology research, the author explores why linear goals can trigger fear, stress, and reduced creativity in our VUCA world. They propose a more flexible, experiment-based approach that aligns better with how our brains actually process growth and rewards.","Nature rarely moves in straight lines, and neither does our personal and professional development.",rethinking-goals-the-science-of-nonlinear-goal-setting
79,Where Geniuses Hide Today,Tomas Pueyo,https://unchartedterritories.tomaspueyo.com/p/where-geniuses-hide-today,"Modern geniuses aren't missing - they're just working in new fields where innovation is still possible. Tomas Pueyo reveals how groundbreaking creators naturally gravitate toward unexplored territories like AI, digital media, and emerging technologies. Rather than trying to revolutionize centuries-old domains like painting or literature, today's brilliant minds are pioneering new frontiers in areas like Christopher Nolan's non-linear storytelling or Sam Altman's AI breakthroughs.","We wanted flying cars, instead we got 140 characters.",where-geniuses-hide-today
80,VibeCheck: OpenAI's Sora,Aleena Vigoda,https://every.to/context-window/vibe-check-openai-s-sora,"OpenAI's text-to-video model Sora finally launches with an unexpected twist - it's a full video editing platform rather than just an API. Aleena Vigoda explores how the new Sora Turbo offers creative tools like Remix, Re-cut, and Blend, competing directly with traditional editing software. While excelling at abstract animations, the model still struggles with physics and human movements, suggesting its immediate impact may be strongest in commercial advertising and micro-game development.","If the creator economy democratized distribution, then the allocation economy is democratizing content production.",vibe-check-openais-sora
81,The new rules of media,One Thing,https://onethingnewsletter.substack.com/p/the-new-rules-of-media,"A sharp dissection of digital media's evolving landscape reveals 20 essential principles for modern success. Kyle Chayka, along with media experts Delia Cai, David Cho, and Nick Quah, explores how personality cults, multi-platform presence, and parasocial relationships now drive audience engagement. Their analysis shows how traditional metrics have given way to direct audience relationships and the rising importance of being camera-ready in an increasingly video-first world.","Everything is a personality cult, and maybe just a cult. You have to cultivate your own, no matter how small.",the-new-rules-of-media
82,I Gave Up on Goals. Here's How I Still Move Forward,Alberto Cabas Vidani,https://theunstoppablecreator.substack.com/p/adaptable-goal-setting-for-content-creators-and-solopreneurs,"Traditional goal-setting falls short in our unpredictable world of content creation and entrepreneurship. Alberto Cabas Vidani reveals how embracing broad ambitions over specific targets led to better outcomes. Through personal setbacks with photography blogs, podcasting ventures, and pandemic disruptions, he discovered that adaptability and constant experimentation trump rigid planning. His approach focuses on setting directional aims while staying flexible enough to pivot when opportunities arise.",But enterprenurship taught me to relinquish control and embrace serendipity.,i-gave-up-on-goals-heres-how-i-still-move-forward
83,Beach Person,Frank Shyong,https://frankbear.substack.com/p/beach-person,"A candid exploration of identity transformation in the digital age begins with the author's decision to reinvent himself as a beach person after a trip to Hawaii. Frank Shyong reveals how modern identity-crafting has become a consumer-driven performance, from buying boogie boards to curating social media presence. His journey exposes broader truths about how technology and capitalism have transformed self-identity into something increasingly purchasable yet potentially hollow.",I think the self seems to be losing meaning as a concept overall. Our social technology offers this infinite ability to try on new selves.,beach-person
84,Why Great Ideas Get Watered Down (and How to Stop It),Rohan Dehal,https://www.productartistry.com/p/why-great-ideas-get-watered-down,"Most products fail not from poor execution, but from playing it too safe at the start. Rohan Dehal challenges the conventional wisdom of conservative MVPs, arguing that diluting bold ideas actually increases the risk of building something irrelevant. Through a practical framework, he demonstrates how focusing on a sacred hypothesis and embracing polarizing responses leads to more meaningful product experiments.",Early adopters don't want a watered-down version of what already exists—they want a glimpse of what could be.,why-great-ideas-get-watered-down-and-how-to-stop-it
85,on social media etiquette,Inigo Laguda,https://www.bedroomcinemaclub.com/p/on-social-media-etiquette,"A viral tweet ignites a deeper exploration of digital content ownership and attribution ethics in our social media age. Inigo Laguda examines how his own writing, stripped of context and credit, spreads across platforms like wildfire. Through personal experiences and cultural analysis, he reveals how our convenience-driven sharing habits often prioritize consumption over respect for creators.","I cannot stress this enough, I am writing to be a writer. I’m not doing this for bants. I do not romanticise being a struggling artist whose genius is only recognised post-mortem.",on-social-media-etiquette
86,"Human Intelligence, Inc.",Jurgen Gravestein,https://jurgengravestein.substack.com/p/human-intelligence-inc,"From ChatGPT to DALL-E, AI systems appear to showcase remarkable intelligence. Jurgen Gravestein peels back the curtain to reveal how these technologies are actually remixes of human knowledge, built from scraped data and hidden human labor. He argues that our awe should be directed not at the AI companies, but at the generations of human minds whose work powers these systems.","Artificial intelligence is human intelligence, remixed.",human-intelligence-inc
87,All behavior makes sense with sufficient information,Adam Singer,https://www.hottakes.space/p/all-behavior-makes-sense-with-sufficient,"Human behavior might seem irrational at first glance, but logic emerges once we understand the hidden variables. Adam Singer explores how ghosting friends, questionable financial choices, and workplace dynamics all stem from invisible scripts shaped by personal experiences, fears, and survival instincts. Using poker as a compelling metaphor, he demonstrates how actions that appear foolish often carry deep strategic significance.",People aren't dumb. The world is hard.,all-behavior-makes-sense-with-sufficient-information
88,a one word difference,Grace | Kizuna,https://kizunanyc.substack.com/p/a-one-word-difference,"Through a powerful lens of post-election reflection, Grace explores the profound impact of choosing to fight 'for' rather than 'against.' She addresses fears within marginalized communities while offering a stirring message of hope to Gen Z, who have inherited unprecedented global challenges yet possess remarkable awareness of humanity's interconnectedness.","Strength lies in the choice to still believe in beauty, joy, hope, and love in spite of those horrors.",a-one-word-difference
89,Hubris & Humility,Garrett Kincaid,https://garrettkincaid.substack.com/p/hubris-and-humility,"A freshly graduated college student embarks on a backpacking journey through Iceland, convinced he has everything figured out. Garrett Kincaid's overconfidence quickly dissolves when he faces basic survival challenges, from ill-fitting gear to the fundamental question of how to relieve himself in the wilderness. Through a chance encounter with an experienced guide and a transformative moment in the highlands, he discovers that true freedom comes from embracing our human limitations.","There's nothing more humbling than not knowing how to shit, and there are few things more euphoric than shitting on the Moon.",hubris-humility
90,Why the deep learning boom caught almost everyone by surprise,Michael Spencer,https://www.ai-supremacy.com/p/why-the-deep-learning-boom-caught,"A fascinating journey through AI history reveals how three visionaries defied skepticism to spark the deep learning revolution. While experts dismissed neural networks, Fei-Fei Li built ImageNet, an unprecedented image dataset, Geoffrey Hinton persisted with neural network research for decades, and Jensen Huang adapted GPUs for non-gaming applications. Timothy Lee chronicles how their convergent innovations in 2012 transformed modern AI, despite widespread doubt from their peers.","Pre-ImageNet, people did not believe in data. Everyone was working on completely different paradigms in AI with a tiny bit of data.",why-the-deep-learning-boom-caught-almost-everyone-by-surprise
91,The Religion of Ramp,Evan Armstrong,https://every.to/napkin-math/the-religion-of-ramp,"A fintech startup defies Silicon Valley norms by building a $7.6 billion company around a simple mission: helping businesses save time and money. Evan Armstrong reveals how Ramp's founders turned expense management software into one of the fastest-growing startups ever by preaching fiscal responsibility instead of wasteful spending. Through calculated decisions like rejecting millions in quick profits and aligning compensation with efficiency, they've created a true believers' movement in corporate finance.","It is hard to make $7.6 billion divine, but Eric Glyman is working on it.",the-religion-of-ramp
92,How to Build a Truly Useful AI Product,Chris Pedregal,https://every.to/thesis/how-to-build-a-truly-useful-ai-product,"The rapid evolution of AI technology demands a new startup playbook. Through his experience building Granola, Chris Pedregal reveals four essential principles for AI product development: avoid solving temporary problems, leverage high-cost models early, prioritize contextual understanding, and focus on narrow, specific use cases. With AI models improving faster than applications can be built, success requires surfing the wave of progress rather than getting tumbled by it.","If building a startup is like playing a tough video game, building a startup in generative AI is like playing that video game at 2x speed.",how-to-build-a-truly-useful-ai-product
93,"Launch When It's Good, Not When It's Perfect",Matt Tomporowski,https://matttomporowski.substack.com/p/launch-when-its-good-not-when-its,"A candid exploration of the publishing process reveals how perfectionism can hinder creative progress. Matt Tomporowski shares insights from launching his second book, explaining why waiting for perfection often conflicts with real-world success. Drawing parallels between a toddler's first steps and creative endeavors, he demonstrates how embracing imperfection and launching when work is 'good enough' leads to growth and improvement.",A book is NEVER ready to launch.,launch-when-its-good-not-when-its-perfect
94,"15 Times to use AI, and 5 Not to",Ethan Mollick,https://www.oneusefulthing.org/p/15-times-to-use-ai-and-5-not-to,"A practical guide to AI's strategic use reveals fifteen scenarios where artificial intelligence shines and five where it falters. Ethan Mollick draws from both scientific research and hands-on experience to show how AI excels at tasks requiring quantity, translation between perspectives, and expert-verified work. But he warns against using it for learning new concepts, high-accuracy requirements, or situations where the struggle itself holds value.","AI is often most useful where we're already expert enough to spot its mistakes, yet least helpful in the deep work that made us experts in the first place.",15-times-to-use-ai-and-5-not-to
95,No time? No problem. Overcoming the productivity illusion,Benjamin Antoine,https://2hourcreatorstack.substack.com/p/no-time-no-problem-overcoming-the,"A transformative look at how the common excuse 'I don't have time' masks deeper issues with energy management and creative fulfillment. Benjamin Antoine shares his personal burnout experience, revealing how focusing on energy levels rather than strict schedules leads to more sustainable creativity. His insight shows that authentic creation flows not from rigid productivity systems, but from genuine excitement and well-managed energy.",The problem isn't time—it's how we manage our energy.,no-time-no-problem-overcoming-the-productivity-illusion
96,Inside the CEO shooter standom,Taylor Lorenz,https://www.usermag.co/p/inside-the-ceo-shooter-standom,"A shocking Manhattan killing has morphed into an unexpected cultural phenomenon, as young people celebrate an unidentified gunman who shot a health insurance executive. Taylor Lorenz reveals how Gen Z has transformed the shooter into a symbol of resistance against healthcare inequity, creating memes, tattoos, and fancams while traditional media struggles to comprehend the public's response.",The majority of our news media is bought by billionaires.,inside-the-ceo-shooter-standom
97,Insurance companies aren't the main villain of the U.S. health system,Noah Smith,https://www.noahpinion.blog/p/insurance-companies-arent-the-main,"A deep dive into the real cost drivers of American healthcare reveals a surprising truth: insurance companies aren't the primary culprits. Noah Smith demonstrates how providers, not insurers, are responsible for sky-high medical costs. While insurance companies like UnitedHealth Group operate on slim profit margins of 2-6%, healthcare providers charge substantially more than their international counterparts.",The insurance companies are simply hired to play the bad guy — and they're paid a relatively modest fee for that service.,insurance-companies-arent-the-main-villain-of-the-us-health-system
98,"3 Offers That Can Make You $5,000 (Even With a Small Audience)",Matt Giaro ⚙️,https://mattgiaro.substack.com/p/3-offers-that-can-make-you-5000-even,"A counterintuitive guide to making money online without a massive following. Matt Giaro challenges the notion that creators need thousands of subscribers to earn well, drawing from his decade of experience making a full-time income with modest email lists of 2,000-8,000 subscribers. He reveals three proven strategies: premium done-for-you services, high-ticket coaching, and mini-courses bundled with group support.",You don't need a BIG audience to make money. You just need the RIGHT people on your list.,3-offers-that-can-make-you-5000-even-with-a-small-audience
99,"The ""It Girl"" Economy",Viktoriia Vasileva,https://www.viksbusycorner.com/p/the-it-girl-economy,"The business of being an internet ""it girl"" has evolved from fleeting cultural cachet to serious financial power. Viktoriia Vasileva examines how figures like Gabbriette Bechtel and Devon Lee Carlson have transformed from social media personalities into lucrative business entities, partnering with luxury brands and building personal empires. This shift marks a dramatic change from when downtown celebrities could only count on cool stories and press mentions.","Culture has shifted. We're all broadcasting all the time, famous in tiny circles of friends and followers.",the-it-girl-economy
