id,title,author,url,summary,quote,slug
100,How I built a $30k Writing Business In 12 months,Derek Hughes,https://derekhughes.substack.com/p/how-i-built-a-30k-writing-business,"A practical roadmap for transforming writing into a profitable online business unfolds through five key steps. Derek Hughes reveals how he went from zero to earning thousands through coaching and digital products. His journey emphasizes the importance of emotional resilience, consistent content creation, and the patience to work without immediate rewards - a strategy that helped him build a 16,000-follower audience.","You're going to spend 12 months working for free, for potentially massive rewards in the future, but with no guarantees.",how-i-built-a-30k-writing-business-in-12-months
101,Found a Saturated Niche? Don't Run. Dive in!,Alberto Cabas Vidani,https://theunstoppablecreator.substack.com/p/saturated-niche-creators-opportunity,"A panic-inducing moment when a major YouTuber entered his Notion tutorial space leads Alberto Cabas Vidani to share valuable insights about embracing crowded niches. Drawing parallels to the enduring success of medical TV dramas, he explains how saturated markets signal strong demand and provide ready-made audience validation. His experience running an Italian YouTube channel reveals how studying competitors' successful content can unlock unexpected opportunities.","If no one is talking about it, no one cares.",found-a-saturated-niche-dont-run-dive-in
102,20 Questions for 2025,Rahim Hirji,https://boxofamazing.substack.com/p/20-questions-for-2025,"A thought-provoking guide to meaningful goal setting emerges as we approach 2025. Rahim Hirji shares a framework that moves beyond typical New Year's resolutions, advocating for SMART objectives across relationships, health, career, and personal growth. Through his family's annual tradition of collaborative goal-setting, he demonstrates how structured reflection can drive meaningful progress in an increasingly AI-driven world.","If today were the last day of my life, would I do what I'm about to do today.",20-questions-for-2025
103,iT's aLL aN iLLuSiOn 🪄😵‍💫,Kyle Raymond Fitzpatrick,https://1234kyle5678.substack.com/p/its-all-an-illusion,"A piercing exploration of our digital culture's hollow rituals and meaningless metrics. Kyle Raymond Fitzpatrick examines how Spotify Wrapped and similar year-end data dumps have devolved into performative exercises, while contrasting these trivialities with serious events like the UnitedHealthcare CEO shooting. The essay culminates in a fascinating reframing of America's holiday hierarchy, suggesting Thanksgiving may have quietly surpassed Christmas in cultural significance.",Wrapped 2024 felt hollow because it was a manifesting of demure bratty brain rot enshittification mindset: our overindulgence has turned to overstimulation as there are too many wrapped concepts.,its-all-an-illusion
104,The 'Work Less' January Experiment,Landon Poburan,https://landonpoburan.substack.com/p/the-work-less-january-experiment,"A bold challenge to traditional work norms emerges from one entrepreneur's battle with burnout. Landon Poburan proposes cutting workdays by 20-25%, limiting focused work to six hours between 7 AM and 1 PM. Based on Stanford research and personal experience, this experiment aims to boost creativity, improve productivity, and foster better work-life balance through structured rest and intentional downtime.",It's about building a business that supports the life I desire to live instead of living a life that supports my business.,the-work-less-january-experiment
105,What Are You Really Building?,Lewis O’Brien,https://dblthink.substack.com/p/what-are-you-really-building,"A timeless parable about three stonecutters reveals how perspective transforms identical work into vastly different experiences. Lewis O'Brien explores how one task can be viewed as tedious labor, purposeful craftsmanship, or visionary creation - demonstrating how our mindset shapes not just our work satisfaction, but our legacy.","The first saw monotony, the second saw purpose, the third saw legacy.",what-are-you-really-building
106,The Chatbot Trap,Charlie Guo,https://www.ignorance.ai/p/the-chatbot-trap,"Current AI interfaces are stuck in a limiting chatbot paradigm, similar to how early smartphones crammed desktop websites into mobile screens. Charlie Guo explores why chatbots create unnecessary cognitive load and suggests a return to direct manipulation interfaces that blend natural language with intuitive controls. His analysis reveals how products like Cursor and Shortwave point toward a future where AI capabilities become more accessible through domain-specific tools.","Right now, it feels like 95% of ""AI-enabled"" products I encounter have welded a chatbot to an existing SaaS app - and in reality, that number should be closer to 5%.",the-chatbot-trap
107,The Editorialization of Brand Social,Kristen Vinakmens,https://kristenvinakmens.substack.com/p/brand-social-gets-editorial,"A fascinating shift is happening in brand social media as companies embrace high-concept editorial photography. Kristen Vinakmen explores how brands like Aritzia, Skims, and Chamberlain Coffee are adopting luxury fashion's playbook, creating magazine-style campaigns that prioritize artistic storytelling over algorithmic appeal. From Nara Smith's retro-futuristic lab scenes to FKA Twigs' gravity-defying performances, these brands are crafting visual narratives that offer respite from typical social media noise.","If you want to stand out on social now, do the opposite of what everyone else is doing, and you may reap the rewards.",brand-social-gets-editorial
108,Social Media: The Biggest Lie,Carly Burr,https://offlineworldwide.substack.com/p/social-media-the-biggest-lie,"A compelling deconstruction of eight common excuses that keep us tethered to social media platforms. Carly Burr challenges the notion that social media is essential for connection, business growth, or staying relevant. She reveals how these digital spaces often create illusions of friendship while preventing deeper, more meaningful relationships and personal growth. Through practical alternatives and thoughtful analysis, she encourages readers to imagine a more intentional life beyond the scroll.","We live in a world where we have 457 online ""friends"" but no one to call when we're having a bad day.",social-media-the-biggest-lie
109,Are We All Just Scrolling Through Life?,Tuğba Avci,https://tugbaavci.substack.com/p/i-tried-to-live-but-i-got-distracted,"A haunting exploration of our modern digital existence reveals how multitasking is destroying our focus and wellbeing. Tuğba Avci examines the shocking cost of constant app-switching: a single phone distraction requires 25 minutes to regain focus, and daily digital interruptions can lower IQ more than smoking marijuana. Through this lens, she advocates for attention activism to combat tech companies' deliberate exploitation of human psychology.","We have spiralled into a world where our rationality, intelligence, and focus slip more and more away.",are-we-all-just-scrolling-through-life
110,New Evidence Changes How We Understand Inflation and Monetary Policy,Keynesian Technology,https://hackernoon.com/new-evidence-changes-how-we-understand-inflation-and-monetary-policy,"This analysis challenges the standard New Keynesian model of inflation dynamics, revealing fundamental flaws in how economists understand monetary policy. Through stochastic equilibrium analysis and bifurcation theory, the research demonstrates that inflation is less forward-looking than previously thought and more influenced by past events. David Staines shows that central banks cannot fine-tune away economic fluctuations as easily as believed, requiring a significant rethinking of monetary policy.",Models that macroeconomists previously thought had multiple equilibria in fact have none.,new-evidence-changes-how-we-understand-inflation-and-monetary-policy-hackernoon
111,You're unhappy because the world keeps you in a constant state of desire,Thomas Kuegler,https://findingtom.substack.com/p/youre-unhappy-because-the-world-keeps-078,"A raw exploration of how modern culture traps us in endless wanting. Thomas Kuegler draws from his past as a successful vlogger in the Philippines to reveal how chasing more - whether it's relationships, money, or fame - creates a cycle of discontent. He contrasts American hustle culture with the simple contentment he observes in Mexican and Filipino communities, suggesting that our obsession with more might be the root of our unhappiness.","In this hyper-Americanized GET AFTER IT MOTHER ****ER!!! world we live in, the pursuit of more is not just part of our culture, but thought to eventually give us happiness.",youre-unhappy-because-the-world-keeps-you-in-a-constant-state-of-desire
112,I Married Someone From A Different Country—Here's What It's Been Like,Thomas Kuegler,https://findingtom.substack.com/p/i-married-someone-from-a-different,"A chance meeting in a Mexican park leads to an unexpected love story filled with cultural clashes and deep connections. Thomas Kuegler navigates the challenges of marrying across cultures, from language barriers and public displays of affection to hot sauce on everything. Through their differences, he discovers that opposing worldviews and cultural gaps can create an extraordinarily powerful bond that transforms both partners.",Some men and women don't want that—and that's fine—but to me they're missing out on something important if they just stay in their bubble forever.,i-married-someone-from-a-different-countryheres-what-its-been-like
113,The HOLY SH*T moment hack no marketer is using,Tom Orbach,https://www.marketingideas.com/p/the-holy-sht-moment-hack-no-marketer,"First-time reactions trump traditional marketing benefits, creating powerful social proof through genuine wow moments. Tom Orbach reveals how Meta successfully leveraged this psychology with their AR glasses launch, while Apple missed a similar opportunity with Vision Pro. He shares seven tactical approaches to manufacture these moments, from forcing painful before scenarios to creating artificial scarcity.","Features tell. Benefits sell. But first ""holy sh*t"" reactions? They show potential customers exactly what they're about to experience themselves.",the-holy-sht-moment-hack-no-marketer-is-using
114,Who Really Creates Trends? (Pinterest Predicts is here),Kira Klaas,https://kiraklaas.substack.com/p/who-really-creates-trends-and-why,"What happens when trend forecasting becomes trend creation? Through a deep dive into Pinterest Predicts 2025, Kira Klaas explores how the platform has evolved from predicting trends to actively shaping them. With an 80% accuracy rate and partnerships with major brands like Marriott Bonvoy and Urban Outfitters, Pinterest is orchestrating a self-reinforcing cycle where predictions become reality through strategic brand collaborations.","Are they predicting trends, or creating them?",who-really-creates-trends-pinterest-predicts-is-here
115,"Why ""we"" want insurance executives dead",Taylor Lorenz,https://www.usermag.co/p/yes-we-want-insurance-executives,A viral reaction to a healthcare CEO's death reveals deep-seated American rage against the insurance industry. Taylor Lorenz examines how UnitedHealthcare's 32% claim denial rate - double the industry average - along with their flawed AI systems and profit-driven policies have created a powder keg of public sentiment. She argues that media outrage over social media reactions misses the broader context of systemic healthcare failures.,"If you have watched a loved one die because an insurance conglomerate has denied their life saving treatment as a cost cutting measure, yes, it's natural to wish that the people who run such conglomerates would suffer the same fate.",why-we-want-insurance-executives-dead
116,Manifesting My Ideal Information Diet,Garrett Kincaid,https://garrettkincaid.substack.com/p/manifesting-my-ideal-information,"A former finance major explores how to break free from mindless media consumption. Garrett Kincaid draws parallel between his natural aversion to sugary drinks and his quest to develop similar disgust for brain-rotting content. Through seven clear rules, including prioritizing books and boycotting algorithmic feeds, he builds a framework for more intentional engagement with digital content.","In every moment, I am either practicing mindfulness and focus or mindlessness and distraction.",manifesting-my-ideal-information-diet
117,A big part of my little success,Anna Mackenzie,https://annamackstack.substack.com/p/a-big-part-of-my-little-success,"A revealing look at how reducing friction leads to meaningful action. Anna Mackenzie shares her journey of building a multi-six-figure portfolio career through simple but powerful systems. Her approach focuses on eliminating barriers through daily dashboards, templated emails, and streamlined workflows – preventing great ideas from dying in what she calls the cavern of inaction.","This cavern of time is where dreams go to die - it's a graveyard full of $100M dollar businesses, exquisite paintings and voices of a generation.",a-big-part-of-my-little-success-1
118,"When You Write, Quantity Kicks Quality's Ass",Khadejah J,https://storycraft855.substack.com/p/when-you-write-quantity-kicks-qualitys,"A personal journey through prolific writing reveals an unexpected truth about success in online content creation. Khadejah J shares how publishing 540 articles in two years led to significant achievements on Medium, surpassing even more skilled writers through sheer consistency. Her approach combines daily idea generation, freestyle writing, and minimal editing—proving that showing up regularly matters more than perfection.",People are more likely to pay attention to the person who plays outside the most.,when-you-write-quantity-kicks-qualitys-ass
119,Admitting What Is Obvious,Dan Shipper,https://every.to/chain-of-thought/admitting-what-is-obvious-206624f9-4dcf-4342-9689-742e63fe8992,"A founder's journey to embracing his true identity as a writer leads to profound business and personal insights. Dan Shipper shares how denying obvious truths about ourselves comes at a great cost, and how his acceptance of being a writer rather than just a founder who writes transformed his approach to running Every. Drawing inspiration from successful creator-entrepreneurs like Bill Simmons, he discovers a path to blend creative work with business leadership.","Billions of dollars in value are wasted every year by people doing the high-status thing they wish they felt compelled to do instead of the weird, low-status thing they actually want to do.",admitting-what-is-obvious
120,The Greatest Threat to Writers,Leigh Stein,https://leighstein.substack.com/p/the-greatest-threat-to-writers,"A provocative exploration of why writers resist sharing digital spaces with video creators, despite similar goals of building audiences and earning from their work. Leigh Stein challenges the literary community's elitism, arguing that the real threat isn't TikTokers or AI – it's the oversaturation of writers competing for limited opportunities. She advocates for embracing cross-platform collaboration and developing unique viewpoints to stand out.","As much as writers feel that AI poses an existential threat to their work, the real competition they face is each other.",the-greatest-threat-to-writers
121,How to be the best kind of drug,Michael Thompson,https://shybydesign.substack.com/p/how-to-be-the-best-kind-of-drug,"A transformative encounter between Pharrell Williams and young musician Maggie Rogers reveals the power of authentic creativity. Michael Thompson uses this story to explore how creators become irresistible by combining contrasting influences into something entirely new - like Rogers blending folk and dance music. The key lies in respecting your past while embracing new directions, ultimately creating something uniquely yours.",The ones that define the future will be the brave ones who embrace their past and treat the present like a present.,how-to-be-the-best-kind-of-drug
122,A big part of my little success,Anna Mackenzie,https://annamackstack.substack.com/p/a-big-part-of-my-little-success,"A deep dive into how reducing friction leads to consistent action and achievement. Anna Mackenzie reveals her systematic approach to running a multi-six-figure portfolio career through practical tools like daily dashboards, templated emails, and streamlined workflows. Her bias for action, built through careful systems design, helps overcome common barriers like self-doubt and procrastination.","This cavern of time is where dreams go to die. It's a graveyard full of $100M dollar businesses, exquisite paintings and voices of a generation.",a-big-part-of-my-little-success
123,The Parental Notion,Johnathan Dodson,https://actofparenting.substack.com/p/end-of-year-warp-up-whats-next-and,"A deeply personal journey unfolds as a young father reflects on his unexpected life path. Johnathan Dodson, who became a father at 17 and husband at 22, shares how his initial notions of parenthood and success transformed through experience. Now approaching 30, he's creating a digital legacy through essays and musings that capture the profound beauty of intentional family life.","No story is more profound in one's life than that of family, whether it's the one we're born into, the one we lose, or the one we build with our own hands and hearts.",end-of-year-warp-up-whats-next-and-bit-about-me
124,The Art of Wintering: Embracing Life's Natural Rhythms,Anne-Laure Le Cunff,https://nesslabs.com/wintering,"When productivity dips and energy wanes, nature offers a powerful lesson in the art of wintering. Drawing from Katherine May's insights, the concept extends beyond seasonal changes to represent intentional periods of retreat and restoration. Just as animals adapt to survive harsh conditions, humans need these vital phases of pulling back to process challenges, rebuild neural pathways, and prepare for future growth.","Instead of enduring moments of darkness, we can welcome and honor them, so they lead to deep transformation and self-renewal.",the-art-of-wintering-how-to-find-strength-in-slowing-down
125,Low-Income Countries are Falling Behind,Joseph Politano,https://www.apricitas.io/p/low-income-countries-are-falling,"Global poverty reduction has hit a devastating roadblock. Despite forty years of progress that reduced extreme poverty from 40% to under 10%, Joseph Politano reveals how COVID-19, inflation, and international conflicts have reversed these gains. The world's poorest nations now grow slower than wealthy ones, with annual per-capita output in the US being 26 times higher than low-income countries. Bright spots exist but many developing countries struggle to achieve economic convergence.",Between-country economic inequality is so large that the 10th percentile of American income is two and a half times as much as the 90th percentile of Indian income,lowincome-countries-are-falling-behind
126,This is Why You're Not Getting Subscribers,Jennie O'Connor,https://d0wntherabbith0le.substack.com/p/this-is-why-youre-not-getting-subscribers,"A masterclass in maximizing Substack's limited profile real estate to attract more subscribers. Jennie O'Connor breaks down how creators can transform generic newsletter titles into magnetic brands, offering practical strategies for crafting compelling profile bios, elevator pitches, and publication descriptions. She presents solutions for both niched and multi-passionate writers, emphasizing the importance of personality-driven content and mobile-friendly formatting.","Sorry, but you're not Pamela Anderson. And even Pamela Anderson calls her publication something more compelling than Pam's Personal Substack.",this-is-why-youre-not-getting-subscribers
127,You Don't Need Permission To Be A Writer,Matt Lillywhite,https://mattlillywhite.substack.com/p/you-dont-need-permission-to-be-a,"A raw exploration of creative self-doubt turns into an empowering call to action. Matt Lillywhite dismantles common writing myths – from needing the perfect niche to waiting for external validation – by sharing his journey from conspiracy-believing novice to successful writer. His message becomes clear: authentic writing isn't about perfection or formulas, but about showing up and trusting your voice.",I'm writing a first draft and reminding myself that I'm simply shoveling sand into a box so that later I can build castles,you-dont-need-permission-to-be-a-writer
128,Get Over the Fear of Monetizing with This Simple Mindset Shift,Alberto Cabas Vidani,https://theunstoppablecreator.substack.com/p/get-over-the-fear-of-monetizing-with,"Money isn't the enemy of authentic content creation - it's the fuel that powers meaningful impact. Alberto Cabas Vidani explores how creators often struggle with monetization due to fears of judgment and audience perception. Drawing from his experience as both a musician and content creator, he reveals why treating content creation as a mere hobby isn't sustainable, especially when life commitments increase.",Money is the fuel that will keep you going so that you can have the impact you desire.,get-over-the-fear-of-monetizing-with-this-simple-mindset-shift
129,"Learn the game, don’t become the game",Paul Millerd,https://pmillerd.com/learn-the-game-dont-become-the-game/,"What happens when we orient our lives around hacking tests instead of doing meaningful work? Drawing from Paul Graham's essay, Miller explores how the traditional path of gaming systems - from college admissions to corporate advancement - has become less necessary in today's economy. Miller shares his personal journey from being a master test-hacker to embracing authentic work, highlighting a crucial shift in how ambitious people can succeed without playing by old rules.",Don’t win by hacking bad tests; win by doing meaningful work.,learn-the-game-dont-become-the-game
130,Thread Boi Writing System™,Harrison Moore,https://www.thenewworkday.com/p/mic-drop-thread-boi,"A biting satire of modern social media writing trends that cleverly mocks the oversimplified, dopamine-driven content culture. Harrison Moore presents five tongue-in-cheek principles for 'successful' online writing, including removing nuance, mastering mic drops, and maximizing emotional ROI. Through playful jabs at single-line formatting and attention-economy writing, Moore exposes the absurdity of sacrificing depth for engagement.",If it cant be said in one sentence (preferably in fewer than six words) then it's not worth saying at all.,thread-boi-writing-systemtm
131,do you want it?,Valerie,https://clubreticent.substack.com/p/do-you-want-it,"Valerie dissects the nature of wanting - not for a person or purchase, but for an unnamed experience that demands to bloom in silence. She wrestles with the vulnerability of admitting desires, comparing her history of wanting things with the present moment, all while carrying a blank piece of paper that symbolizes unlimited potential. The essay weaves through personal history, from Soviet upbringing to Mount Rainier confessions, ultimately arriving at a universal truth about courage.","I've been good at wanting, always, but never half as good at faith, and one needs both for proper alchemy.",do-you-want-it
132,Beyond Butter Chicken,Perzen Patel,https://perzen.substack.com/p/ai-bad-butter-chicken,"A humorous exploration of butter chicken's transformation from authentic Murgh Makhani to a global phenomenon reveals deeper issues in Indian cuisine representation. Writer Perzen Patel examines how this single dish overshadows India's vast culinary diversity, while proposing how AI could help expand diners' palates beyond the stereotypical curry house menu. From personalized restaurant recommendations to smarter content algorithms, she envisions technology as a tool for celebrating regional Indian dishes rather than perpetuating oversimplified versions of classics.","AI won’t fix bad butter chicken, but it can inspire us to explore the richness of Indian cuisine beyond it.",can-ai-cure-the-world-of-bad-butter-chicken
133,no original thoughts club,Tina Zhang,https://digitaltinz.substack.com/p/no-original-thoughts-club,A thoughtful exploration of how algorithmic recommendations and fear of bad taste are reshaping our ability to form genuine opinions. Tina Zhang weaves personal anecdotes about Spotify playlists and childhood music choices with broader observations about the homogenization of style and language in digital culture. She argues that our increasing reliance on curated recommendations and fear of appearing uncool has created a culture where developing authentic taste requires deliberate resistance against algorithmic influences.,Three years ago I applied for a job at spotify where I presented an impassioned (and somewhat half baked) thesis on how the platform was missing out on the greenfield opportunity to become more social.,no-original-thoughts-club
