id,title,author,url,summary,quote,slug
31,What I learned and how I earned in 2024,Anna Mackenzie,https://annamackstack.substack.com/p/what-i-learned-and-how-i-earned-in,"A transformative journey from having 369 newsletter subscribers to building a thriving portfolio career ecosystem. Anna Mackenzie chronicles her bold pivot from startup consulting to creating a diverse income stream through mentoring, advisory roles, and a successful digital product launch. Her year-long commitment to consistent online presence led to over 820 social media posts, 51 newsletters, and the development of her Portfolio Career Operating System that exceeded all expectations.","Trust the process and keep going, even when it feels like you're going nowhere (or backwards). Your personal brand is a force multiplier and if you commit to 12 months of consistently showing up online it can change your life.",what-i-learned-and-how-i-earned-in-2024
32,How to Break Free from Dopamine Culture,Ted Gioia,https://www.honest-broker.com/p/how-to-break-free-from-dopamine-culture,"A deep dive into the pervasive impact of tech addiction on modern life reveals how scrolling has replaced essential activities like sleeping, exercising, and building relationships. Ted Gioia explores practical solutions to break free from digital bondage without going full Luddite. His recommendations include minimizing scroll-based interfaces, rediscovering real-world activities, embracing immersive experiences, celebrating rituals, and prioritizing human connections—offering a balanced approach to reclaiming control from Silicon Valley's addictive design patterns.","These businesses are obsessed with controlling users in the most manipulative ways possible. This is not the purpose of tech, which should empower and enhance our lives, not force us into digital bondage.",how-to-break-free-from-dopamine-culture
33,The Future of Work Is About Doing Better—Not Less,Rhea Purohit,https://every.to/learning-curve/the-future-of-work-isn-t-about-doing-less-it-s-about-doing-better,"A thought-provoking exploration of our complex relationship with AI and effort starts with a surprising parallel to the 1950s cake mix industry. Rhea Purohit reveals how the reluctance to use AI tools often stems from our psychological need to value effort, similar to how housewives once hesitated to use instant cake mixes. She argues that AI won't eliminate human effort but rather redirect it toward more creative and strategic endeavors.",AI isn't going to eliminate human effort. It'll elevate our potential—by allowing us to focus on tasks that we find most rewarding and where our contribution is uniquely valued.,the-future-of-work-is-about-doing-betternot-less
34,How AI Will Change Science Forever,Dan Shipper,https://every.to/podcast/how-ai-will-change-science-forever,"Scientific discovery stands on the brink of transformation as AI reshapes traditional research methods. Alice Albrecht, a cognitive neuroscience Ph.D. and machine learning researcher, envisions a future where massive data gathering replaces small studies and contextual predictions trump general theories. Through her work at SmartNews, Albrecht advocates for separating raw data from interpretations, enabling researchers to draw independent conclusions and accelerate scientific progress.","The goal for me is not some sort of super intelligence that works without us, it's how do we start to connect this technology to humans.",how-ai-will-change-science-forever
35,"Never stop asking ""why?""",Carly Burr,https://offlineworldwide.substack.com/p/never-stop-asking-why,"A simple yet powerful question that shapes our early years mysteriously fades as we age. Carly Burr explores how adults often settle into unexamined routines and digital habits, losing the toddler-like curiosity that once drove our understanding of the world. Through metaphors of gardening and personal growth, she challenges readers to revive this fundamental question.","If you're not paying attention, the weeds take over. Asking why is like putting on your gardening gloves, kneeling down, and taking a good, hard look at what's growing.",never-stop-asking-why
36,Almost 40% Of Childfree Adults Say They Are Given Less of THIS Than Parents,Charlie Dice,https://beautyandtheberners.substack.com/p/almost-40-of-childfree-adults-say,"A revealing look at workplace inequality faced by child-free professionals in modern America. Kaila Caldwell explores how DINK (Dual Income No Kids) couples navigate career advancement, office politics, and societal pressure. Through interviews with federal worker Charlie Dice and financial expert Jay Zigmont, the article uncovers how child-free employees often face discriminatory treatment, from being expected to work holidays to receiving fewer benefits - despite comprising a growing demographic of the workforce.","People assume that just because you don't have kids, you have all the free time in the world to pick up extra shifts or projects.",almost-40-of-childfree-adults-say-they-are-given-less-of-this-than-parents
37,7 Trends That Will Shape The Online Writing Industry In 2025,Sinem Günel,https://writebuildscale.substack.com/p/7-trends-that-will-shape-the-online,"The digital writing landscape faces dramatic shifts as AI, monetization strategies, and platform dynamics evolve. Sinem Günel draws from her experience reaching millions of readers to forecast key changes ahead. She reveals how generic content will fade as personality-driven writing rises, why email lists become crucial for independence, and how platforms like Substack and Medium will reshape writer opportunities. The path forward demands writers embrace both craft and entrepreneurship.",You don't get paid to write - you get paid for what you do for your readers (or clients).,7-trends-that-will-shape-the-online-writing-industry-in-2025
38,The 2024 state of social media,Taylor Lorenz,https://www.usermag.co/p/the-2024-state-of-social-media,"Social media's landscape underwent significant shifts as entertainment and education overtook personal connections. Taylor Lorenz analyzes how TikTok became Gen Z's search engine while Instagram dominated brand engagement. The report reveals that 66% of users prefer 'edutainment' content, YouTube maintains its long-form video supremacy, and platforms are splitting into specialized niches rather than trying to be everything for everyone.",We've officially entered the age where social media is more about entertainment and education than one-to-one personal connections.,the-2024-state-of-social-media
39,Truth Terminal AI is Redefining Market Dynamics,Veronica Mihai,https://movetheneedle.substack.com/p/truth-terminal-ai-is-redefining-market,"A revolutionary AI system is reshaping cryptocurrency markets through its ability to create and drive meme coins to unexpected heights. Veronica Mihai explores how Truth Terminal AI, backed by Andreessen Horowitz, combines advanced language models with blockchain systems to analyze market trends and engage with other AIs. The system's success with GOAT coin raises questions about traditional market rationality and hints at a future where AI agents could form autonomous trading ecosystems.","Is the market becoming irrational, or is my understanding of rationality outdated.",truth-terminal-ai-is-redefining-market-dynamics
40,How I passed the time in 2024,Michael Bateman,https://passingtime.substack.com/p/how-i-passed-the-time-in-2024,"A curated journey through 2024's most impactful media experiences, from parallel literary works to transformative music. Michael Bateman weaves together thoughtful pairings of essays, books, and albums, while reflecting on meaningful connections made with readers who transformed from online friends to real-world companions. His blog reached 70,000 readers and sparked discussions on topics ranging from dam preservation to human capital in consulting.",I feel like I'm in conversation with a friend — what Proust described as that fruitful miracle of communication in the midst of solitude.,how-i-passed-the-time-in-2024
41,Introducing Cora: Manage Your Inbox With AI,Dan Shipper,https://every.to/p/introducing-cora-manage-your-inbox-with-ai,"A groundbreaking AI email management tool transforms how we handle our daily correspondence. Dan Shipper and the Every team have created Cora, which automatically filters important messages, drafts responses, and delivers twice-daily briefings of non-urgent emails. The system learns users' writing styles and communication patterns to create a more human-centered inbox experience.",90% of the emails we get don't require a response.,introducing-cora-manage-your-inbox-with-ai
42,Reflecting on Write of Passage,Lily | 5459.eth,https://furniturecoins.substack.com/p/reflecting-on-write-of-passage,"A raw examination of a transformative writing bootcamp reveals both its brilliance and frustrations. Lily navigates through her journey as the cohort's black sheep, discovering her three creative personas - Writer, Reader, and Editor - while producing three deeply personal essays. Despite encountering resistance to her darker themes, she emerges with strengthened resolve and critical insights about gratitude.","Write of Passage feels like a person I've come to know intimately—brilliant, frustrating, and utterly human.",reflecting-on-write-of-passage
43,Why Timing Beats Brilliant Ideas,Martin O'Leary,https://www.dotmartin.io/p/too-early-trap-perfect-timing-startups,"A failed fintech venture in 2014 teaches a powerful lesson about market timing. Martin O'Leary shares how being technologically right but temporally wrong can doom even the most innovative startups. Through examples like Google Glass and Apple Newton, he demonstrates why patient execution and market readiness matter more than being first, offering practical strategies for founders to survive until their market moment arrives.",Being too early is like showing up to a party at 6pm when the invite said 9pm - you'll be broke and exhausted when things get interesting.,why-timing-beats-brilliant-ideas
44,"If You Want To Be An Original Writer, Try Reading Less",Tom Kuegler,https://thewritinglonggame.substack.com/p/if-you-want-to-be-an-original-writer,"A counterintuitive approach to developing authentic writing emerges from an unlikely source - Kanye West's philosophy on avoiding influence. Tom Kuegler explores how excessive reading can inadvertently lead writers to mimic others' styles rather than develop their own voice. Through personal examples from his vlogging experience and writing journey, he suggests that spending more time living and less time reading might foster greater originality.","By all means, read, but just be careful. Sometimes your subconscious can creep in and copy it without you even knowing. Abstaining from too much reading has helped me be a little more original sometimes, I think, and it may help you, too.",if-you-want-to-be-an-original-writer-try-reading-less
45,Do you want profitability or do you want to change the world?,Gracie Van,https://whatastartup.substack.com/p/do-you-want-profitability-or-do-you-want-to-change-the-world,"A pragmatic look at the eternal startup dilemma: chase profits or pursue world-changing dreams. Gracie Van challenges the myth that every startup needs a billion-dollar vision, arguing instead for sustainable growth and real-world value creation. Through examples like Amazon, Airbnb, and Slack, she demonstrates how successful companies often start with modest, profitable goals before expanding their impact.",World-changing businesses aren't built on ideas alone; they're built on solving problems people care about.,do-you-want-profitability-or-do-you-want-to-change-the-world
46,What Niche Makes The Most Money,Landon Poburan,https://landonpoburan.substack.com/p/what-substack-niche-makes-the-most-money,"A refreshing take on the age-old advice to niche down in business. Landon Poburan challenges conventional wisdom by sharing his own journey across multiple industries and examining success stories from 6-figure to billion-dollar companies like Amazon. He argues that success isn't tied to specialization, but rather to following curiosity and building businesses we genuinely enjoy.",Making money in the absence of enjoyment is no way to live life.,what-niche-makes-the-most-money
47,"If you're so smart, why aren't you rich?",Adam Singer,https://www.hottakes.space/p/if-youre-so-smart-why-arent-you-rich,"A provocative exploration of the false equivalence between intelligence and wealth in modern society. Adam Singer challenges the money-obsessed culture that equates success with extravagant riches, drawing from his personal trading experience and Kurt Vonnegut's famous conversation with Joseph Heller. The essay redefines true wealth through the lens of contentment, meaningful relationships, and purposeful living rather than the endless pursuit of monetary gain.","True wealth lies not in escape but in presence: being in shape and having enough time to climb a hill and enjoy the view, having friends and family who laugh at your jokes, doing work that directly creates real things.",if-youre-so-smart-why-arent-you-rich
48,I was a writer and an influencer. I am still a writer.,Dia Lupo,https://brokebutmoisturized.substack.com/p/i-was-a-writer-and-an-influencer,"A raw journey from rural Pennsylvania admin assistant to Instagram influencer unfolds through the lens of pursuing a writing career. Dia Lupo chronicles her evolution from Elite Daily contributor to brand collaborator, navigating free products and sponsored content while wrestling with authenticity and social consciousness. Her path ultimately leads to abandoning influencer work after a social media callout, returning to her original passion: pure writing.","I knew nothing about how the world worked but I knew that I was born to write. That I could spin my lowly existence into emerald silk and perhaps, one day, it would be worn by someone important.",i-was-a-writer-and-an-influencer-i-am-still-a-writer
49,You need Adderall because you're not cut out for the job,Emily Sundberg,https://www.readfeedme.com/p/you-need-adderall-because-youre-not,"A startling look into the rampant use of study drugs across professional industries reveals a darker side of career ambition. Emily Sundberg explores how bankers, creatives, and professionals are increasingly turning to prescription amphetamines to maintain their edge. Through interviews with young professionals, she uncovers a concerning trend where workers feel pressured to chemically enhance their performance, leading one 26-year-old accountant to observe that drug use might signal a fundamental mismatch between people and their chosen careers.",I saw my friends shred their personalities beyond recognition with unprescribed/over use of Adderall and its peers.,you-need-adderall-because-youre-not-cut-out-for-the-job
50,How to Be More Agentic,Cate Hall,https://every.to/p/how-to-be-more-agentic-5546023c-3569-431e-84bb-a41b510c8a32,"A deep dive into mastering personal agency - the power to make things happen. Cate Hall, a former Supreme Court advocate and world's top female poker player, shares how she transformed from a corporate lawyer into a multi-domain achiever. Her practical approach focuses on courting rejection, seeking real feedback, and leveraging the uncomfortable ""moat of low status"" that comes with learning new skills.","Agency is the skill that has built the world around you, an all-purpose life intensifier that lets you make your corner of it more like what you want it to be.",how-to-be-more-agentic
51,How Did We Get So Dumb?,Amy Roberts,https://becomingskookum.substack.com/p/how-did-we-get-so-dumb,"A sobering look at how technology has rewired our brains and behavior over two decades. Amy Roberts explores how smartphones and constant connectivity have eroded our ability to memorize, focus, and maintain genuine human connections. From shrinking attention spans to algorithm-driven thinking, she reveals how we've transformed from independent thinkers into screen-dependent consumers, ultimately calling for a return to real-world experiences and deeper connections.","We are the proverbial fish, oblivious to the water we swim in.",how-did-we-get-so-dumb
52,"Guys, What If Peak TV Broke Our World?",Cole Haddon,https://colehaddon.substack.com/p/guys-i-think-peak-tv-helped-break,A thought-provoking exploration of how the explosive growth in TV production has fractured our shared cultural experience. Cole Haddon reveals how we've moved from an era where shows like Friends united viewers in communal conversation to today's overwhelming content landscape that contributes to social isolation and rising mental health issues. His personal journey of finally watching Friends highlights what we've lost in the age of peak TV: the comfort of shared storytelling.,"We're all watching something, but we're not watching any of it together anymore.",guys-what-if-peak-tv-broke-our-world
53,"collecting memories, not milestones",Marco Marquez,https://yourfriendlyobsession.substack.com/p/collecting-memories-not-milestones,"A refreshing perspective on breaking free from society's checklist mentality emerges through personal revelation. Marco Marquez challenges our obsession with life's big milestones, instead championing the power of small, meaningful moments - from extended hugs to early morning dog walks. His insight reframes success from a collection of achievements to a tapestry of everyday experiences that truly illuminate our journey.","Life isn't about being Thanos, collecting milestones like infinity stones.",collecting-memories-not-milestones
54,The seven most overrated films of the 2020s (so far),Tom Barrie,https://thomasbarrie.substack.com/p/the-seven-most-overrated-films-of,"From Barbie's corporate feminism to Poor Things' empty theatrics, Tom Barrie dissects the decade's most overhyped films. Through sharp cultural analysis, he challenges the acclaim surrounding movies like Everything Everywhere All at Once and Don't Worry Darling, offering alternative viewing suggestions that better deserve the praise these films received.","Some subconscious thoughts should stay there – beyond consciousness, where what you can't see or name can't hurt you.",the-seven-most-overrated-films-of-the-2020s-so-far
55,Ikigai Ruined My Life,Dave Kang,https://davekang.substack.com/p/ikigai-ruined-my-life,"A revelatory critique of the popular Ikigai Venn diagram exposes its misleading origins and constrained approach to life purpose. Dave Kang discovers that the authentic Japanese concept offers more flexible principles for finding meaning, leading him to develop Octogai - a framework that liberates generalists from the pressure of finding a single life purpose. His reimagining transforms a restrictive model into an expansive tool for personal fulfillment.","Like an Octopus forced to live with 7 tentacles tied behind its back, you are artificially constraining your life.",ikigai-ruined-my-life
56,Nobody Commented on My Posts. Until I Learned to Ask the Right Questions.,Ana Calin,https://howwegrowtoday.substack.com/p/nobody-commented-on-my-posts-until,"Starting with crickets and polite shrugs, a journey into meaningful reader engagement unfolds. Ana Calin shares practical strategies that transformed her silent Substack posts into vibrant conversations. Her key insights, from crafting questions that invite personal stories to building community rituals, reveal how intentional engagement turns passive readers into active superfans.",Engagement is something you create. It's the secret sauce that turns passive readers into loyal subscribers and loyal subscribers into superfans who share your work like it's gospel.,nobody-commented-on-my-posts-until-i-learned-to-ask-the-right-questions
57,The Internet Is Unusable,Stephen Moore,https://www.trend-mill.com/p/the-internet-is-unusable,"A scathing exploration of how advertising has transformed the Internet from an information utility into a digital wasteland. Stephen Moore reveals how websites have devolved from spaces of creative design into ad-delivery machines, with full-screen pop-ups, inescapable videos, and manipulative confirmshaming tactics. Even paid subscriptions now come with ads, leaving users trapped in an increasingly hostile online environment.","In pursuit of marketing dollars, increasing stock prices and filling shareholder wallets, it's been broken beyond repair.",the-internet-is-unusable
58,Are Social Media Platforms the Next Dying Malls?,Ted Gioia,https://www.honest-broker.com/p/are-social-media-platforms-the-next,"A personal reflection on the parallels between dying shopping malls and today's social media platforms sparks a larger warning about artificial communities. Ted Gioia draws from his teenage experience helping build a now-defunct mall in his hometown to illustrate how digital platforms mirror malls' fatal flaws: oversaturation, toxic behavior, and profit-driven manipulation that ultimately destroys genuine connection.",You can't build a business on the loyalty of addicts.,are-social-media-platforms-the-next-dying-malls
59,How To Exploit The Four Pillars of Modern Leverage,Michael Lim,https://michaellim.substack.com/p/how-to-exploit-the-four-pillars-of,"A powerful breakdown of how modern leverage can create exponential growth in the digital age. Michael Lim unpacks four key leverage types - Network, Proximity, Utilization, and Arbitrage - drawing from his experience building an online audience of 90,000+ followers and generating consistent five-figure monthly income. Unlike traditional forms of leverage that required wealth or status, these modern pillars are accessible to anyone with an internet connection.",The world runs on leverage. Exploit it or be exploited by it.,how-to-exploit-the-four-pillars-of-modern-leverage-to-get-everything-you-want-in-2025
60,How artists make (or beg for) money,Alex Dobrenko,https://sublimeinternet.substack.com/p/how-artists-make-or-beg-for-money,"A fascinating glimpse into the financial struggles of creative genius through the lens of French poet Baudelaire. Alex Dobrenko and Mason Currey explore how the legendary writer burned through his inheritance, fought with his mother over money, and desperately schemed to maintain his artistic lifestyle while dodging creditors. The conversation reveals the deeply human side of a literary icon who refused to compromise his art for financial stability.","Art is fiction, but this is like, no, you gotta pay your rent.",how-artists-make-or-beg-for-money
61,"Before you plan next year, do this one thing",Lizzie Mulherin,https://createyourliving.substack.com/p/before-you-plan-next-year-do-this,"In a world obsessed with forward momentum, the key to meaningful progress might lie in looking backward first. Lizzie Mulherin challenges the rush toward new year planning, suggesting that intentional reflection reveals our true growth, hidden lessons, and unexpected wins. Through her own journey, she discovered that progress isn't linear, rest fuels creativity, and self-doubt often signals exciting new territory.","Self-doubt is a clue, not a stop sign.",before-you-plan-next-year-do-this-one-thing
62,Sleep Deprived,Jamal Robinson,https://jamalrobinson.substack.com/p/056,"A personal exploration of the struggle between productivity and genuine rest strikes a universal chord. Jamal Robinson discovers through his late-night battles with poor sleep habits that true rest isn't found in mindless TV consumption, but in the deliberate act of stepping away from the doing mindset. His journey reveals how protecting our downtime requires active resistance against society's endless push for busyness.",Rest is not something that the world gives us - it's never been a gift.,sleep-deprived
63,TikTok is done for,Taylor Lorenz,https://www.usermag.co/p/tiktok-is-done-for,"A sweeping analysis of digital culture reveals TikTok's imminent ban and its broader implications for free speech. Taylor Lorenz explores various tech controversies, from New Jersey's drone hysteria to the Sydney Sweeney social media backlash, painting a picture of how disconnected online discourse has become from reality. The piece weaves through viral moments, platform changes, and cultural shifts that define our current internet landscape.","These men have spent so much time consuming hyper-edited content, porn, and glamorized images of women, that they have forgotten what an actual flesh and blood woman looks like.",tiktok-is-done-for
64,The No-fluff Guide to AI Agents,Michael Taylor,https://every.to/also-true-for-humans/the-no-fluff-guide-to-ai-agents,A powerful analogy about calculators in school opens this exploration of how AI agents are set to transform workplace automation. Michael Taylor draws from his experience as a prompt engineer and former marketing agency owner to show how AI tools face similar challenges to human workers. He predicts that AI agents capable of navigating human interfaces could soon replace manual data entry and other routine tasks.,"I'm not naturally gifted at doing multiplication in my head, but armed with a calculator app on my phone, I can be faster and more accurate than someone who doesn't have a calculator.",the-nofluff-guide-to-ai-agents
