id,title,author,url,summary,quote,slug
1,Creator Gravity: How to Pull People Into Your Orbit,Alice Lemee,https://internetly.substack.com/p/creator-gravity-how-to-pull-people,"In a digital world drowning in content, certain creators possess a magnetic force that consistently draws audiences back for more. Alice Lemee, drawing from her experience ghostwriting for influential creators, reveals that lasting audience attraction comes down to three key elements: delivering healthy content that nourishes minds, maintaining a clear purpose that guides followers, and radiating authentic energy that resonates through every piece of work.","Gravity is the force that pulls you into someone's orbit. It's that magnetic attraction to someone's work. And unlike virality that flares and fades, gravity is lasting.",creator-gravity-how-to-pull-people-into-your-orbit
2,The Never-Ending Lockdown,Diana Lind,https://thenewurbanorder.substack.com/p/the-never-ending-lockdown,"Five years post-pandemic, our society faces a troubling phenomenon where digital life increasingly dominates physical spaces. Diana Lind explores this ""human doom loop"" - a cycle where decreased real-life interactions lead to diminished quality of physical spaces, which further discourages in-person activities. She illustrates this through a Whole Foods café transformation, where a vibrant community space became an Amazon shipping facility, highlighting how digital convenience is reshaping our social landscape.","Throughout the pandemic, the media focused on the idea of the urban doom loop, in which remote work would kill downtowns, triggering a downward spiral of reduced services that would cause people to leave cities. What went overlooked has turned out to be the bigger and even more consequential story: the human doom loop.",the-neverending-lockdown
3,Good conversations have lots of doorknobs,Adam Mastroianni,https://www.experimental-history.com/p/good-conversations-have-lots-of-doorknobs,"A fresh perspective on why some conversations soar while others sink emerges from an improv comedian's stage experience. Adam Mastroianni explores the dynamic between conversation 'givers' and 'takers,' challenging the notion that one style is superior. Through research and personal insights, he reveals that great dialogue isn't about giving or taking—it's about creating 'affordances,' conversational doorknobs that invite engagement and allow rapid-fire rapport to develop naturally.","Talking to another person is like rock climbing, except you are my rock wall and I am yours. If you reach up, I can grab onto your hand, and we can both hoist ourselves skyward.",good-conversations-have-lots-of-doorknobs
4,Why Nostalgia Feels Good: The Science Behind Our Memories,Giacomo Falcone,https://giacomofalcone.substack.com/p/why-nostalgia-feels-good,"A deep dive into the fascinating science of nostalgia begins with childhood memories of Pokémon cards and GameBoy battles. Giacomo explores how this once-feared 'brain disease' evolved into a recognized psychological tool for finding life's meaning. Through insights from experts like Professor Krystine Batcho, we learn how nostalgic feelings serve as emotional anchors during uncertain times and help strengthen our sense of identity—though they can occasionally amplify sadness in worry-prone individuals.","In childhood, we were loved simply for who we were.",why-nostalgia-feels-good-the-science-behind-our-memories
5,"Sorry (Not Sorry), Self-Promotion Doesn't Work",Tara McMullin,https://www.whatworks.fyi/p/sorry-not-sorry-self-promotion-doesnt,"A refreshing take on why self-promotional content fails in today's digital landscape. Tara McMullin explores how social media platforms' evolution toward profit maximization has trapped creators in an ineffective cycle of endless self-promotion. Through examining Cory Doctorow's concept of 'enshittification,' she reveals how platforms degrade from user-friendly spaces to profit-driven wastelands, forcing creators to abandon meaningful content for desperate self-promotion. Her solution? Create platform-specific content that delivers genuine value instead of constant calls to action.","Self-promotional content is inherently valueless. Really, it's contentless—that is, lacking substance or meaning of its own.",sorry-not-sorry-selfpromotion-doesnt-work
6,Don't live a copy/paste life,Suzanne Heyn,https://suzanneheyn.substack.com/p/dont-live-a-copypaste-life,"A raw manifesto against societal conformity explores how we've become trapped in predetermined life scripts. Suzanne Heyn challenges the monotonous cycle of college, career, and consumption that leaves us disconnected from our authentic selves. Through punchy observations about rush-hour traffic, corporate jargon, and algorithmic living, she urges readers to break free from the collective programming and embrace their unique creative destiny.","Technology was supposed to free us, yet in many ways, it's made us clones. We spend so much time scrolling the algorithm, we've become the algorithm.",dont-live-a-copypaste-life
7,Is the end of social media near?,Marloes De Vries,https://marloesdevries.substack.com/p/is-the-end-of-social-media-near,"A personal journey through social media's evolution reveals its transformation from a genuine connection hub to an addictive, commodified space. Marloes De Vries reflects on her path from teenage blogger to successful Instagram illustrator, witnessing how platforms that once fostered authentic communities now prioritize algorithms and ads over human interaction. Her experience highlights a growing exodus of creators who are rediscovering the value of offline connections and questioning whether digital spaces can truly fulfill our basic human need for belonging.","On average, we spend 5.5 hours each day staring at our screens—time that could be spent meeting friends or family. Yet, we'd rather watch a series of Instagram stories during our lunch break than have a chat with a colleague.",is-the-end-of-social-media-near
8,Just delete them,Caoilainn,https://caoilainn.substack.com/p/just-delete-them,"A powerful reflection on the bizarre social media ritual of following people who once caused us pain. Through casual likes and story views, we maintain hollow connections with former bullies and frenemies, all while carrying the weight of old wounds. Caoilainn challenges this digital norm, arguing that we shouldn't feel obligated to keep toxic presences in our online spaces just because unfollowing seems dramatic.","If I wouldn't invite you to my house, then you're not welcome in my online space either. What astrologers call a Saturn Return, I call turning 30 and simply not having the energy to carry dead weight anymore.",just-delete-them
9,How I'm Building a Six-Figure Newsletter in 2025 (The Unconventional Way),Wes Pearce,https://escapethecubicle.substack.com/p/thinking-about-starting-a-newsletter,"A failed attempt at building a subscription newsletter leads to an unexpected breakthrough. Wes Pearce discovers that combining LinkedIn's reach with Substack's engagement creates a powerful growth engine. Instead of chasing paid subscriptions, he focuses on creating digital products and masterclasses, turning a modest following into a thriving business with 3,300+ subscribers and daily sales. His approach challenges conventional wisdom by prioritizing organic growth through valuable content rather than aggressive promotion.","Selling is like offering someone a piece of cheesecake...You walk around the room and offer each person your cheesecake. Many will say ""No"", but some will say ""This is exactly what I needed.""",how-im-building-a-sixfigure-newsletter-in-2025-the-unconventional-way
10,What Notion's $300M Sales Funnel Looks Like,Andreas Just,https://grwth.substack.com/p/what-notions-300m-sales-funnel-looks,"A deep dive into how Notion scaled to 100 million users and $300M in revenue through strategic marketing funnels. Andreas Just reveals how the company uses Account-Based Marketing to target different user segments, from solopreneurs to enterprise clients. Rather than promoting its entire platform, Notion creates targeted content and ads highlighting specific use cases, backed by success stories from companies like Toyota and Figma. Their approach combines organic growth through community building with sophisticated paid acquisition strategies, focusing primarily on middle and bottom-of-funnel tactics.","Because of Notion's versatility, I've always been curious to understand how they promote this tool. And I found the answer: ABM (Account-Based Marketing).",what-notions-300m-sales-funnel-looks-like
11,The Only Moat AI Can't Copy in 2025,Martin,https://www.dotmartin.io/p/ai-taste-moat-competitive-advantage-2025,"In a world where AI can generate perfect logos, write compelling copy, and ship clean code, the true differentiator becomes human taste and creative judgment. Martin explores how the democratization of professional-quality output through AI tools is making execution-based advantages obsolete. Through examples like Apple's iPod and Coca-Cola's New Coke failure, he illustrates why understanding the 'why' behind creative decisions matters more than ever. The piece reveals how genuine craft and intentional taste will become the last remaining moat in a landscape where technical perfection is available to everyone.","When AI makes everything polished, the definition of 'good' shifts. Silicon Valley feels like a karaoke night where every startup is trying to sing the same song.",the-only-moat-ai-cant-copy-in-2025
12,The Barbell Creator: How to Deal With the Outsized Role of Luck in the Creator Economy,Ayodeji,https://dontstarve.substack.com/p/the-barbell-creator-how-to-deal-with,"In the unpredictable world of content creation, success often hinges on luck and timing more than pure talent. Ayodeji shares his journey from Medium's top earner to advocate for a balanced approach to creative success. He proposes the 'Barbell Creator' strategy: build a predictable cash-flow business first, then use that stability to take bigger creative risks – much like investors who put 90% in safe investments and 10% in high-risk, high-reward opportunities.","For every mega-followed creator — to whom we retroactively assign genius — there are thousands of creators of similar talent, who had similar ideas and executed a similar strategy but failed to achieve the same result because they were simply at the wrong place at the wrong time.",the-barbell-creator-how-to-deal-with-the-outsized-role-of-luck-in-the-creator-economy
13,The interesting thing about interesting things,Harrison Moore,https://www.thenewworkday.com/p/the-interesting-thing-about-interesting-things,"A deep dive into why certain writings captivate our minds while others fade into obscurity. Harrison Moore unpacks sociologist Murray S. Davis's groundbreaking research revealing that truly fascinating content must challenge our existing beliefs, not just present new information. Through 12 distinct patterns of interestingness, from Composition to Organization, Moore shows how great writers from Freud to modern bloggers have mastered the art of disrupting conventional wisdom.","Whilst all interesting things are novel, not all novelty is interesting, which means that to write truly compelling stuff, we have go beyond simply presenting new information.",the-interesting-thing-about-interesting-things
14,"The paradox of 'enough': wrestling with work, worth and rest",Max Pete,https://maxpete.substack.com/p/the-paradox-of-enough-wrestling-with,"A raw exploration of the endless cycle of modern work culture and the relentless pursuit of financial security. Max Pete reflects on his struggle to find balance while juggling a full-time tech job and multiple side projects. His childhood experiences with poverty fuel an innate fear of not having enough, leading to a paradoxical situation where working harder leaves less time for life's genuine pleasures. Despite enjoying his work, the pressure to constantly maximize productivity reveals a deeper American cultural condition.","The irony is that the harder and more I work, the less time I have to live and enjoy the things that ultimately bring me happiness.",the-paradox-of-enough-wrestling-with-work-worth-and-rest
15,What's ChatGPT Projects and How to Use Them as a Writer?,Yana G.Y.,https://www.yana-g-y.com/p/whats-chatgpt-projects-and-how-to,"A new feature in ChatGPT promises to bring order to the chaos of chat management and revolutionize how writers organize their AI interactions. Yana G.Y. explores how Projects lets users create dedicated spaces with custom instructions and knowledge bases, similar to Custom GPTs but with unique organizational benefits. While Projects streamlines personal workflow, it differs from Custom GPTs in key ways - lacking external integrations and monetization options but offering superior chat management.",Projects make our experience within ChatGPT better. Custom GPTs allow us to build more advanced GPT instances.,whats-chatgpt-projects-and-how-to-use-them-as-a-writer
16,Indian immigration is great for America,Noah Smith,https://www.noahpinion.blog/p/indian-immigration-is-great-for-america,"A heated debate erupts over H-1B visas and Indian immigration following Trump's appointment of Sriram Krishnan as AI policy advisor. Noah Smith unpacks extensive research showing that H-1B workers actually boost American tech employment and innovation, not harm it. Through economic data and historical context, he demonstrates how Indian immigrants have become integral to America's success in tech, business, and politics, while challenging the emerging anti-Indian sentiment on the political right.","If you force the world's best talent to play for the other side, America will lose period.",indian-immigration-is-great-for-america
17,How to Identify The Limiting Factor in Any System,Lewis O’Brien,https://dblthink.substack.com/p/how-to-identify-the-limiting-factor,"A deep dive into Eliyahu Goldratt's Theory of Constraints reveals how identifying bottlenecks can transform system performance. Mirek Stanek applies these principles to software development, showing how engineering teams can tackle technical debt by focusing on one critical constraint at a time. The approach aligns with Richard Rumelt's strategy philosophy - success comes from solving the right problem rather than attempting everything simultaneously.","The thing with developers is that there is always one more thing that must be improved in their code. As their managers, we only hear, We never have enough time to fix a tech debt that will soon take the entire company down.",how-to-identify-the-limiting-factor-in-any-system
18,Is it possible to be online without falling into the negatives?,Carly Burr,https://offlineworldwide.substack.com/p/is-it-possible-to-be-online-without,"A refreshing take on mindful internet usage emerges from a decade of social media experimentation. Carly Burr reveals how she abandoned traditional platforms like Instagram and Facebook in favor of YouTube and Substack, where she focuses on creating value rather than seeking validation. Her approach centers on being a producer rather than a consumer, showing up intentionally via laptop only when there's something meaningful to share, while building a fulfilling offline life first.","Get out there and build the kind of life that doesn't depend on A SCREEN, surface level connection, fleeting validation, likes or comments to feel whole.",is-it-possible-to-be-online-without-falling-into-the-negatives
19,In praise of the hundred page idea,Tracy Durnell,https://tracydurnell.com/2024/12/17/in-praise-of-the-hundred-page-idea/,"A compelling case for the power of concise nonfiction books that clock in around 100 pages. Tracy Durnell argues that these shorter works often deliver more impact than their lengthier counterparts, citing examples like Timothy Snyder's On Tyranny and Strunk and White's Elements of Style. She challenges the American tendency to bloat ideas into 300-page volumes and questions the practice of bundling essays, suggesting that singular, focused ideas often work better in standalone formats.","For me, the value in ideas is connection and synthesis: it's more useful to my type of thinking to have a slightly shallower understanding of more ideas, so I can build a mental web between all of them.",in-praise-of-the-hundred-page-idea-tracy-durnells-mind-garden
20,Being a Developer in the Age of Reasoning AI,Mani Doraisamy,https://near.tl/developer-forever/forum/announcement/being-a-developer-in-the-age-of-reasoning-ai.anc-4b87de19-f7cf-4ef0-91c8-e28b260fd9ad.html,"A profound exploration of how OpenAI's o3 launch transforms the developer landscape by introducing program synthesis capabilities. Mani Doraisamy examines how AI's ability to generate algorithms on the fly mirrors developer thinking, leading to two emerging approaches: hands-on developers who review and own AI-generated code, and hands-off users who rely completely on AI. The piece raises critical questions about human reasoning and responsibility in an AI-powered future.","If we forfeit our understanding, the reasoning in AI would bring an end to reasoning in humans. Our ability to understand the code that AI generates will decide if we are the puppeteers or puppets of AI.",being-a-developer-in-the-age-of-reasoning-ai
21,Seven Predictions for Tech in 2025,Alex Kantrowitz,https://www.bigtechnology.com/p/seven-predictions-for-tech-in-2025,"A fascinating peek into tech's near future reveals some surprising twists ahead. Alex Kantrowitz envisions a major company abandoning generative AI, Microsoft's potential leadership shake-up, and TikTok surviving its ban threat under a Trump presidency. His analysis points to shifting dynamics in social media's relevance, the rise of brain-computer interfaces, and a sobering outlook for Apple's Vision Pro. These predictions build on 2024's steady tech progress, particularly in AI capabilities and autonomous driving.","GenAI is a powerful technology, but it's not for everyone. Over the past two years, a large number of companies have invested significantly in figuring out whether AI models, and bots like ChatGPT and Microsoft Copilot, could give them an edge.",seven-predictions-for-tech-in-2025
22,Surrender to the Ocean's Powerful Way of Being,Marie Vandoorne,https://marievandoorne.substack.com/p/surrender-to-the-oceans-powerful,"A transformative surfing lesson on the remote shores of Tenerife becomes an unexpected catalyst for emotional release. Marie Vandoorne encounters Ito, an unconventional surf instructor whose spiritual wisdom goes far beyond teaching board techniques. Through his guidance, she learns to embrace the ocean's power and let go of emotional baggage, discovering that surfing isn't just about catching waves - it's about surrendering to life's natural flow and finding freedom in the process.","Baby girl, why are you like this? Why are you blocking yourself from letting go? Why are your muscles all tightened up? I don't know what is going on in your life, but something is holding you back.",surrender-to-the-oceans-powerful-way-of-being
23,What are the checks and balances on the power of Elon Musk?,Noah Smith,https://www.noahpinion.blog/p/what-are-the-checks-and-balances,"A startling look at how Elon Musk has amassed unprecedented political influence in American democracy. Noah Smith examines how Musk's control of X (formerly Twitter), SpaceX, and his massive financial backing of Trump has created a new kind of power player who can sway government policy through social media manipulation, funding threats, and direct political pressure. The piece explores the unsettling possibility that traditional checks and balances weren't designed for this type of private sector influence.","Powerful people are simply inherently untrustworthy, because the consequences of misplacing your trust in them are so grave. But for most of modern American history, there have been checks and balances on these leaders, meaning that if they did turn out to be bad, there would be plenty of institutions and opponents in place to limit the damage.",what-are-the-checks-and-balances-on-the-power-of-elon-musk
24,51 Questions To Make Your Year-End Review The Most Insightful Ever,Alberto Cabas Vidani,https://theunstoppablecreator.substack.com/p/51-questions-year-end-review,"A comprehensive guide to meaningful year-end reflection emerges from this carefully curated list of powerful questions. Alberto Cabas Vidani breaks down self-evaluation into five key areas: achievements, challenges, personal growth, content creation, and relationships. Instead of a one-size-fits-all approach, he encourages readers to focus on questions that spark personal insight, emphasizing that sustainable creator success stems from continuous self-improvement.","A question is right only when it makes a lightbulb switch on in YOUR mind. That's because I strongly believe without a constant work on ourselves, we can't succeed as creators.",51-questions-to-make-your-yearend-review-the-most-insightful-ever
25,All I want for Christmas is an animatronic boar,Emily Sundberg,https://www.readfeedme.com/p/all-i-want-for-christmas-is-an-animatronic,"A delightful holiday shopping guide through New York's most charming specialty stores unfolds as Emily Sundberg explores unique gift ideas. From French hair clips at Shahmiri in Park Slope to a $7,600 animatronic boar at John Derian, she weaves together personal recommendations with an insider's tour of boutique shopping spots, featuring interviews with local business owners and tips for last-minute holiday hunters.","Instagram and online research are major tools, of course, and allow me to go down different pathways and access meaningful work in an incredibly helpful way. Reaching out with reverence for someone's line, introducing myself and what the store is about, and why there could be a meaningful connection… that's something I really like.",all-i-want-for-christmas-is-an-animatronic-boar
26,Momental Musings no.1,Johnathan Dodson,https://substack.com/@createchtivity/p-153414115,"A new digital space emerges to help modern parents navigate the complexities of family life. Johnathan Dodson creates a platform where practical parenting tools merge with personal storytelling, offering insights into strengthening family bonds and making the most of everyday moments.",Experience tools and tales crafted to deepen connections and cherish every precious moment with your loved ones.,momental-musings
27,What just happened,Ethan Mollick,https://www.oneusefulthing.org/p/what-just-happened,"A groundbreaking month in AI development has unleashed a wave of transformative capabilities. Ethan Mollick details how GPT-4 level intelligence now runs on home computers, while new models like o1 demonstrate superhuman performance in medical diagnosis. From AI that can spot mathematical errors in research papers to Google's Veo 2 creating cinema-quality videos, the pace of advancement suggests we're witnessing not just incremental progress, but revolutionary leaps in artificial intelligence capabilities.","Intelligence, of a sort, is available on demand. And the new, tiny Phi 4 from Microsoft is GPT-4 level and can almost run on your phone, while its slightly less capable predecessor, Phi 3.5, certainly can.",what-just-happened
28,The Return of Magic,Packy McCormick,https://www.notboring.co/p/the-return-of-magic,"A personal journey through consciousness and synchronicity leads Packy McCormick to an unexpected spiritual awakening. After encountering The Telepathy Tapes podcast and experiencing a series of meaningful coincidences, he explores how modern technology and ancient wisdom might be converging toward a more enchanted worldview. His transformation reflects a broader cultural shift away from pure materialism toward a perspective that embraces both scientific progress and mystical experience.","The science of today is a light matter. Those amazing truths that our descendants will discover are even now all around us, staring us in the eyes, so to speak; and yet we do not see them.",the-return-of-magic
29,On embracing our imperfections,Michael Thompson,https://shybydesign.substack.com/p/on-embracing-our-imperfections,"A transformative journey begins in a bustling Baltimore mortgage office, where a young man with a severe stutter faces his greatest fear: sales calls. Michael Thompson discovers that his perceived weakness becomes his greatest strength, as clients appreciate his authenticity over smooth-talking pitches. His experience reveals how embracing imperfections and leading with genuine care can outperform traditional aggressive sales tactics.","All those years of beating myself up, and it turns out my unique selling point was being myself. My mind was blown. Sure, I wasn't for everyone. But I didn't have to be.",on-embracing-our-imperfections
30,the era of deoptimizing,Valerie,https://clubreticent.substack.com/p/the-era-of-deoptimizing,"A raw exploration of the exhausting pursuit of endless self-optimization hits a breaking point. Valerie unpacks her relationship with productivity, ambition, and the constant drive for improvement that's left her feeling trapped in a cycle of never-enough. Through sharp self-reflection, she arrives at a radical solution: embracing simplicity and surrendering the need to constantly prove her worth.","I run on shame and self-vitriol, I say jokingly, but I'm only half-joking, of course. It's my bread and butter; my gasoline, too.",the-era-of-deoptimizing
